{
  "story_id": "oct9-a1-gemini-skills",
  "grammar": "hub_spoke",
  "title": "Reusable business skills bind tools and context",
  "subtitle": "Modular procedures turn repeated work into governed agent execution without rewriting prompts",
  "nodes": [
    {
      "id": "n1",
      "label": "Reusable skill library",
      "detail": "Personal, team and global skill packages"
    },
    {
      "id": "n2",
      "label": "Skill selection",
      "detail": "Choose modular workflow for a task"
    },
    {
      "id": "n3",
      "label": "Tool registry",
      "detail": "Bind approved enterprise systems"
    },
    {
      "id": "n4",
      "label": "Context and memory",
      "detail": "Task, semantic, procedural and episode state"
    },
    {
      "id": "n5",
      "label": "Policy gate",
      "detail": "Authorize tools, access and human review"
    },
    {
      "id": "n6",
      "label": "Reviewed output",
      "detail": "Reusable result and learning feedback"
    }
  ],
  "callouts": [
    {
      "label": "Agent Skills story",
      "detail": "Skill is a reusable procedure, not only a label"
    },
    {
      "label": "Permission boundary",
      "detail": "Tools and networks require explicit controls"
    },
    {
      "label": "Procedural learning",
      "detail": "Version a skill when workflow rules change"
    }
  ],
  "flow_label": "Select skill → bind → execute → review",
  "footer": "Reusable procedures preserve organizational process intent",
  "group_labels": [
    "Skill source",
    "Bound execution"
  ],
  "palette": {
    "accent1": "#0C837F",
    "accent2": "#4268A9",
    "accent3": "#BB8045"
  },
  "schema_version": "daily-compiler-diagram-spec-v2"
}
