{
  "schema_version": "daily-compiler-diagram-spec-v2",
  "story_id": "smoke-layered",
  "grammar": "layered_system",
  "title": "Layers of a Reliable AI Brief",
  "subtitle": "Each layer adds durable meaning while preserving the layers below.",
  "nodes": [
    {"id":"n1","label":"Evidence","detail":"Authoritative sources and dates"},
    {"id":"n2","label":"Editorial","detail":"Selection, focus, novelty, relevance"},
    {"id":"n3","label":"Content","detail":"Stories, media, Watchlist, books"},
    {"id":"n4","label":"Visuals","detail":"Mechanism-specific diagram specifications"},
    {"id":"n5","label":"Bundle","detail":"Exact immutable semantic package"},
    {"id":"n6","label":"Reader","detail":"Permanent routes and reader controls"}
  ],
  "callouts": [
    {"label":"Traceability","detail":"Every output maps back to durable evidence"},
    {"label":"No Rework","detail":"Completed layers stay valid across recovery"},
    {"label":"Isolation","detail":"Shadow output never mutates production"}
  ],
  "flow_label": "Evidence compounds upward",
  "footer": "Layered-system grammar smoke test • professional explanatory layout",
  "palette": {"accent1":"#2764d9","accent2":"#10a887","accent3":"#8a54d9"}
}
