{
  "schema_version": "daily-compiler-diagram-spec-v2",
  "story_id": "smoke-hub",
  "grammar": "hub_spoke",
  "title": "One Bundle Coordinates Every Reader Asset",
  "subtitle": "A single semantic bundle becomes the authoritative source for all reader surfaces.",
  "nodes": [
    {"id":"n1","label":"Edition Bundle","detail":"One durable source of reader truth"},
    {"id":"n2","label":"Stories","detail":"Six complete permanent articles"},
    {"id":"n3","label":"Media","detail":"Two videos and two podcasts"},
    {"id":"n4","label":"Watchlist","detail":"Daily emerging-signal changes"},
    {"id":"n5","label":"Books","detail":"Reader-value learning connections"},
    {"id":"n6","label":"Images","detail":"Six reviewed explanatory diagrams"}
  ],
  "callouts": [
    {"label":"Consistency","detail":"Homepage and story pages share one source"},
    {"label":"Portability","detail":"The bundle is independent of compiler internals"},
    {"label":"Determinism","detail":"GitHub reproduces the same reader output"}
  ],
  "flow_label": "One bundle, many projections",
  "footer": "Hub-and-spoke grammar smoke test • immutable semantic center",
  "palette": {"accent1":"#0f78c7","accent2":"#14a273","accent3":"#8552d2"}
}
